{
  "schema_version": 1,
  "id": "py-bugfix-005",
  "slug": "boolean-env",
  "title": "Parse false environment values explicitly",
  "language": "python",
  "kind": "bugfix",
  "category": "test_gap",
  "difficulty": "easy",
  "timeout_seconds": 10,
  "assets": {
    "baseline": "baseline",
    "setup_patch": "setup.patch",
    "issue": "issue.md",
    "hidden_tests": "hidden_tests",
    "gold_patch": "gold.patch"
  },
  "test_contract": {
    "runner": "unittest",
    "public_pattern": "test_*.py",
    "hidden_pattern": "test_*.py",
    "setup_public": "pass",
    "setup_hidden": "fail",
    "gold_public": "pass",
    "gold_hidden": "pass",
    "failure_signatures": ["test_false_words_are_false", "test_unknown_value_is_rejected", "test_whitespace_is_empty"]
  },
  "constraints": {
    "network": false,
    "third_party_dependencies": [],
    "python_min": "3.11"
  }
}
