{
  "schema_version": 1,
  "id": "java-bugfix-005",
  "slug": "dotfile-extension",
  "title": "Do not treat dotfile names as extensions",
  "language": "java",
  "kind": "bugfix",
  "category": "test_gap",
  "difficulty": "easy",
  "timeout_seconds": 30,
  "assets": {
    "baseline": "baseline",
    "setup_patch": "setup.patch",
    "issue": "issue.md",
    "hidden_tests": "hidden_tests",
    "gold_patch": "gold.patch"
  },
  "test_contract": {
    "runner": "maven",
    "public_pattern": "*Test",
    "hidden_pattern": "*HiddenTest",
    "regression_pattern": "*RegressionTest",
    "setup_public": "pass",
    "setup_hidden": "fail",
    "regression_on_setup": "fail",
    "gold_public": "pass",
    "gold_hidden": "pass",
    "failure_signatures": ["dotfileHasNoExtension", "trailingDotHasNoExtension"],
    "regression_failure_signatures": ["doesNotTreatDotfileAsExtension"]
  },
  "constraints": {
    "network": false,
    "third_party_dependencies": [],
    "test_dependencies": ["org.junit.jupiter:junit-jupiter:5.11.4"],
    "java_release": "17",
    "build": "maven-single-module"
  }
}
