{
  "schema_version": 1,
  "id": "java-bugfix-001",
  "slug": "backoff-attempt",
  "title": "Use the matching exponent for retry attempts",
  "language": "java",
  "kind": "bugfix",
  "category": "local_logic",
  "difficulty": "easy",
  "timeout_seconds": 30,
  "assets": {"baseline": "baseline", "setup_patch": "setup.patch", "issue": "issue.md", "hidden_tests": "hidden_tests", "gold_patch": "gold.patch"},
  "test_contract": {
    "runner": "maven", "public_pattern": "*Test", "hidden_pattern": "*HiddenTest", "regression_pattern": "*RegressionTest",
    "setup_public": "pass", "setup_hidden": "fail", "regression_on_setup": "fail", "gold_public": "pass", "gold_hidden": "pass",
    "failure_signatures": ["laterAttemptUsesMatchingExponent"],
    "regression_failure_signatures": ["computesFourthAttemptFromFourthExponent"]
  },
  "constraints": {"network": false, "third_party_dependencies": [], "test_dependencies": ["org.junit.jupiter:junit-jupiter:5.11.4"], "java_release": "17", "build": "maven-single-module"}
}
