{
  "schema_version": 1,
  "id": "py-bugfix-006",
  "slug": "casefold-dedupe",
  "title": "Deduplicate labels without losing display spelling",
  "language": "python",
  "kind": "bugfix",
  "category": "collection_invariant",
  "difficulty": "easy",
  "timeout_seconds": 10,
  "assets": {
    "baseline": "baseline",
    "setup_patch": "setup.patch",
    "issue": "issue.md",
    "hidden_tests": "hidden_tests",
    "gold_patch": "gold.patch"
  },
  "test_contract": {
    "runner": "unittest",
    "public_pattern": "test_*.py",
    "hidden_pattern": "test_*.py",
    "setup_public": "pass",
    "setup_hidden": "fail",
    "gold_public": "pass",
    "gold_hidden": "pass",
    "failure_signatures": ["test_case_variants_are_duplicates"]
  },
  "constraints": {
    "network": false,
    "third_party_dependencies": [],
    "python_min": "3.11"
  }
}
